{
  "$schema": "https://json-schema.org/draft/2020-12/schema",
  "type": "object",
  "additionalProperties": false,
  "required": [
    "schema_version",
    "skill",
    "language",
    "context",
    "sources",
    "content"
  ],
  "properties": {
    "schema_version": {
      "const": "1.0"
    },
    "skill": {
      "const": "tw-edu-anti-ai-assessment"
    },
    "language": {
      "const": "zh-TW"
    },
    "context": {
      "type": "object",
      "additionalProperties": false,
      "required": [
        "subject",
        "grade",
        "topic"
      ],
      "properties": {
        "subject": {
          "type": "string",
          "minLength": 1
        },
        "grade": {
          "type": "string",
          "minLength": 1
        },
        "topic": {
          "type": "string",
          "minLength": 1
        }
      }
    },
    "sources": {
      "type": "array",
      "items": {
        "type": "object",
        "additionalProperties": false,
        "required": [
          "title",
          "status"
        ],
        "properties": {
          "title": {
            "type": "string",
            "minLength": 1
          },
          "url": {
            "type": "string"
          },
          "status": {
            "enum": [
              "verified",
              "user_provided",
              "pending"
            ]
          }
        }
      }
    },
    "content": {
      "type": "object",
      "additionalProperties": false,
      "required": [
        "title",
        "items"
      ],
      "properties": {
        "title": {
          "type": "string",
          "minLength": 1
        },
        "items": {
          "type": "array",
          "minItems": 1,
          "items": {
            "type": "object",
            "additionalProperties": false,
            "required": [
              "id",
              "assessment_item",
              "dimensions",
              "total_score",
              "reason"
            ],
            "properties": {
              "id": {
                "type": "string",
                "minLength": 1
              },
              "assessment_item": {
                "type": "string",
                "minLength": 1
              },
              "dimensions": {
                "type": "array",
                "minItems": 1,
                "items": {
                  "type": "object",
                  "additionalProperties": false,
                  "required": [
                    "name",
                    "score",
                    "reason"
                  ],
                  "properties": {
                    "name": {
                      "type": "string",
                      "minLength": 1
                    },
                    "score": {
                      "type": "number",
                      "minimum": 0
                    },
                    "reason": {
                      "type": "string",
                      "minLength": 1
                    }
                  }
                }
              },
              "total_score": {
                "type": "number",
                "minimum": 0
              },
              "reason": {
                "type": "string",
                "minLength": 1
              },
              "redesign": {
                "type": "string",
                "minLength": 1
              }
            }
          }
        }
      }
    }
  }
}
